{
  "protocol": "erenshor.logs.live",
  "protocolVersion": "3.0.0",
  "schemaVersion": "3.0.0",
  "frameId": 1,
  "kind": "hello",
  "sentAtMs": 1800000000000,
  "producer": {
    "name": "ErenshorLogsMod",
    "modVersion": "2026.5.17.95539912",
    "gameVersion": "playtest",
    "buildCommit": "5b1d2c8"
  },
  "payload": {
    "activeSessionId": "session-1",
    "capabilities": ["eventBatch", "diagnosticBatch", "stats"],
    "requiredWebCapabilities": ["protocolV3"],
    "health": {
      "status": "healthy",
      "captureAvailable": true
    },
    "patches": [
      { "id": "Stats.DamageMe", "required": true, "status": "active" },
      { "id": "SiraetheEvent.Update", "required": false, "status": "missing" }
    ],
    "limits": {
      "maxFrameBytes": 262144,
      "maxEventsPerBatch": 256,
      "diagnosticRingSize": 32
    },
    "diagnosticSummary": {
      "fatal": 0,
      "error": 0,
      "warning": 1,
      "info": 0
    }
  }
}
